{
  "schema_version": "1.0",
  "action_proposal_id": "action-proposal-SYNTH-001",
  "site_id": "gbos.localhost",
  "processing_purpose": "sales_follow_up",
  "proposal_version": "action-proposal-v1",
  "proposal_revision": 1,
  "action_type": "internal.work_item.propose",
  "status": "proposed",
  "decision_ref": "decision-SYNTH-001",
  "fact_version_refs": [
    {
      "fact_id": "verified-fact-SYNTH-001",
      "fact_version": 1
    }
  ],
  "evidence_refs": [
    "evidence-record-SYNTH-001"
  ],
  "requested_by": "sales-agent-SYNTH-001",
  "target_ref": "work-item-SYNTH-001",
  "target_revision": 0,
  "payload": {
    "summary": "Draft an internal follow-up work item."
  },
  "payload_digest": "aaaaaaaaaaaaaaaaaaaaaaaaaaaaaaaaaaaaaaaaaaaaaaaaaaaaaaaaaaaaaaaa",
  "policy_version": "action-guard-v1",
  "created_at": "2026-08-06T03:10:00Z",
  "correlation_id": "corr-SYNTH-001"
}
